{
  "schemaVersion": 1,
  "kind": "issue-loop",
  "vendor": "grok",
  "model": "grok-4.6",
  "attribution": "marker-join",
  "outcome": "merged",
  "usage": {
    "inputUncached": 1200,
    "cacheRead": 800,
    "cacheCreation": 100,
    "output": 400,
    "reasoning": 50
  },
  "compactionCount": 0,
  "startedAt": "2026-08-25T15:00:00Z",
  "endedAt": "2026-08-25T16:00:00Z",
  "vendorSessionId": "sess_opaque_1",
  "issueNumber": 2288,
  "stages": [
    {
      "id": "discover",
      "usage": {
        "inputUncached": 200,
        "cacheRead": 0,
        "cacheCreation": 0,
        "output": 40,
        "reasoning": 0
      }
    }
  ],
  "claimId": "0b186d45-421e-4c2d-910e-930f922e3148",
  "prNumber": 1,
  "effort": "M",
  "toolCallCount": 12,
  "turnCount": 4,
  "includesSubagents": false,
  "ambiguous": false
}
